{
  "schema": "gentle-ai.work-reconcile/v1",
  "contract": "gentle-ai.work-reconcile/v1",
  "previousRevision": "sha256:aaaaaaaaaaaaaaaaaaaaaaaaaaaaaaaaaaaaaaaaaaaaaaaaaaaaaaaaaaaaaaaa",
  "diagnosticRef": "sha256:bbbbbbbbbbbbbbbbbbbbbbbbbbbbbbbbbbbbbbbbbbbbbbbbbbbbbbbbbbbbbbbb",
  "reconciliationRef": "sha256:cccccccccccccccccccccccccccccccccccccccccccccccccccccccccccccccc",
  "outcome": "no_delivery_confirmed",
  "status": {
    "schema": "gentle-ai.work-status/v1",
    "contract": "gentle-ai.work-status/v1",
    "workRunId": "organic-recovery",
    "revision": "sha256:dddddddddddddddddddddddddddddddddddddddddddddddddddddddddddddddd",
    "publicState": "needs_your_decision",
    "routeDecision": "direct_inline",
    "routePhase": "implementation_selected",
    "implementationRoute": "direct_inline",
    "verification": {
      "outcome": "not_required",
      "resultRefs": []
    },
    "deliveryIntentRef": "sha256:eeeeeeeeeeeeeeeeeeeeeeeeeeeeeeeeeeeeeeeeeeeeeeeeeeeeeeeeeeeeeeee",
    "diagnostic": {
      "ref": "sha256:ffffffffffffffffffffffffffffffffffffffffffffffffffffffffffffffff",
      "code": "delivery_not_completed",
      "message": "Reconciliation proved that the candidate was not delivered.",
      "nextAction": "start_fresh_work_run"
    }
  }
}
