{
  "schema": "gentle-ai.work-reconcile/v1",
  "contract": "gentle-ai.work-reconcile/v1",
  "previousRevision": "sha256:aaaaaaaaaaaaaaaaaaaaaaaaaaaaaaaaaaaaaaaaaaaaaaaaaaaaaaaaaaaaaaaa",
  "diagnosticRef": "sha256:bbbbbbbbbbbbbbbbbbbbbbbbbbbbbbbbbbbbbbbbbbbbbbbbbbbbbbbbbbbbbbbb",
  "reconciliationRef": "sha256:cccccccccccccccccccccccccccccccccccccccccccccccccccccccccccccccc",
  "outcome": "delivery_confirmed",
  "status": {
    "schema": "gentle-ai.work-status/v1",
    "contract": "gentle-ai.work-status/v1",
    "workRunId": "organic-recovery",
    "revision": "sha256:dddddddddddddddddddddddddddddddddddddddddddddddddddddddddddddddd",
    "publicState": "ready",
    "routeDecision": "direct_inline",
    "routePhase": "implementation_selected",
    "implementationRoute": "direct_inline",
    "verification": {
      "outcome": "not_required",
      "resultRefs": []
    },
    "deliveryIntentRef": "sha256:eeeeeeeeeeeeeeeeeeeeeeeeeeeeeeeeeeeeeeeeeeeeeeeeeeeeeeeeeeeeeeee"
  },
  "deliveryResultRef": "sha256:ffffffffffffffffffffffffffffffffffffffffffffffffffffffffffffffff"
}
